{
  "schemaVersion": "kmass.scoreboard.v0.1",
  "recordType": "KmassScoreboard",
  "recordId": "kmass-baseline-2026-08-01",
  "metricsContractRef": "docs/kmass-metrics-v1.md",
  "measuredAt": "2026-08-01T18:05:00Z",
  "environment": {
    "name": "prophet-platform-prod",
    "description": "Live GKE Autopilot cluster; measurements taken in-cluster against ClusterIP service DNS to exclude ingress/WAN variance.",
    "clusterRef": "gke_socioprophet-platform_us-central1_prophet-platform"
  },
  "metrics": [
    {
      "metricId": "TAB.TEXT.GRAN",
      "figureRow": "Textual Granularity",
      "type": "Outcome",
      "unit": "Top-1 accuracy @ unit",
      "phaseTargets": { "phase1": "80% @ document", "phase2": "80% @ paragraph", "phase3": "80% @ sentence" },
      "state": "UNMEASURED",
      "measuredValue": null,
      "sampleSize": null,
      "measurementProtocol": "Top-1 exact match against labeled target set, min 30 queries per phase per modality (contract §Measurement protocols)",
      "evidenceArtifacts": [],
      "runLog": null,
      "phaseClaim": "none",
      "vacuousPass": false,
      "blockedBy": [
        "No labeled query/target set exists anywhere in the estate",
        "No durable text corpus to evaluate against (see TAB.TEXT.SCALE)",
        "search-orchestrator returns 0 results for all queries, so accuracy is undefined"
      ],
      "notes": "Accuracy cannot be defined while the retrieval path returns the empty set for every input."
    },
    {
      "metricId": "TAB.VIDEO.GRAN",
      "figureRow": "Video Granularity",
      "type": "Outcome",
      "unit": "Success@5 / Recall@5",
      "phaseTargets": { "phase1": "65% @ video", "phase2": "65% @ 1-min clip", "phase3": "65% @ frame" },
      "state": "UNBUILT",
      "measuredValue": null,
      "sampleSize": null,
      "measurementProtocol": "Success@5 or Recall@5 with IoU threshold against labeled temporal target window",
      "evidenceArtifacts": [],
      "runLog": null,
      "phaseClaim": "none",
      "vacuousPass": false,
      "blockedBy": [
        "No video, media, ASR, or transcode service exists in the cluster (verified: zero matching pods across all namespaces)",
        "No media catalog or segment index",
        "videolab/imagelab/speechlab are lab repos, not deployed services"
      ]
    },
    {
      "metricId": "TAB.TEXT.SCALE",
      "figureRow": "Text Sources",
      "type": "Capacity",
      "unit": "count",
      "phaseTargets": { "phase1": 20000, "phase2": 120000, "phase3": 800000 },
      "state": "MEASURED",
      "measuredValue": 12,
      "sampleSize": null,
      "measurementProtocol": "Sum of retrievable documents across all live index services, read from each service's own health/stats endpoint",
      "evidenceArtifacts": [
        "sherlock-engine /healthz -> {\"docs\":12,\"engine\":\"tantivy\",\"dense\":false}",
        "commons-search /healthz -> {\"store\":\"memory\",\"count\":0}",
        "memoryd /healthz -> {\"store\":{\"backend\":\"memory\",\"resource_count\":0,\"event_count\":0,\"memory_count\":0}}",
        "search-orchestrator /v1/search/debug/config -> academy_repository.record_count=1421, mode=in-memory"
      ],
      "runLog": "docs/reports/kmass-baseline-readout-2026-08-01.md#run-log",
      "phaseClaim": "none",
      "vacuousPass": false,
      "blockedBy": [],
      "notes": "12 retrievable documents against a Phase-1 target of 20,000 = 0.06%. The search-orchestrator additionally holds 1421 seeded academy records, but they are NOT retrievable (0 results for every query tried, all modes) so they are excluded from the retrievable count. Root cause is architectural, not volumetric: every store in the retrieval tier is non-durable (see finding: ephemeral-retrieval-tier)."
    },
    {
      "metricId": "TAB.VIDEO.SCALE",
      "figureRow": "Video Sources",
      "type": "Capacity",
      "unit": "hours",
      "phaseTargets": { "phase1": 40, "phase2": 220, "phase3": 400 },
      "state": "UNBUILT",
      "measuredValue": 0,
      "sampleSize": null,
      "measurementProtocol": "Media catalog duration sum + segment index cardinality",
      "evidenceArtifacts": ["No video/media/ASR pods found in any namespace"],
      "runLog": "docs/reports/kmass-baseline-readout-2026-08-01.md#run-log",
      "phaseClaim": "none",
      "vacuousPass": false,
      "blockedBy": ["No media ingest, catalog, or segment index capability is deployed"]
    },
    {
      "metricId": "TAC.CAPTURE.FRICTION",
      "figureRow": "Easy and Natural",
      "type": "Friction",
      "unit": "minutes / fact",
      "phaseTargets": { "phase1": 10, "phase2": 5, "phase3": 2 },
      "state": "UNMEASURED",
      "measuredValue": null,
      "sampleSize": null,
      "measurementProtocol": "Timestamped capture traces, min n=30 per contract sampling rule",
      "evidenceArtifacts": [],
      "runLog": null,
      "phaseClaim": "none",
      "vacuousPass": false,
      "blockedBy": [
        "No capture-trace instrumentation exists in goose-notes or any capture surface",
        "No deployed capture endpoint in-cluster to time against"
      ],
      "notes": "goose-notes is the designated capture surface but is not deployed to the measured environment and emits no timing traces."
    },
    {
      "metricId": "TAD.LATENCY.JIT",
      "figureRow": "Just-in-Time",
      "type": "Outcome",
      "unit": "seconds",
      "phaseTargets": { "phase1": 60, "phase2": 8, "phase3": 1 },
      "state": "MEASURED",
      "measuredValue": 0.0088,
      "sampleSize": 30,
      "measurementProtocol": "End-to-end query-to-answer completion, 30 distinct queries, in-cluster to exclude ingress variance",
      "evidenceArtifacts": [
        "search-orchestrator /v0/search/query: n=30 mean=8.7ms p50=8.8ms p95=9.4ms ok=30/30",
        "sherlock-engine /search: n=30 mean=9.1ms p50=6.9ms p95=8.3ms"
      ],
      "runLog": "docs/reports/kmass-baseline-readout-2026-08-01.md#run-log",
      "phaseClaim": "none",
      "vacuousPass": true,
      "blockedBy": [],
      "notes": "VACUOUS PASS. p50 of 8.8ms nominally beats even the Phase-3 target of 1 second by ~113x, but every one of the 30 queries returned zero results. Latency over an empty result set measures nothing. This value MUST NOT be reported as a Phase-3 claim; it must be re-measured once retrieval returns real results."
    },
    {
      "metricId": "TAD.ACTIONS.JE",
      "figureRow": "Just-enough",
      "type": "Friction",
      "unit": "action count",
      "phaseTargets": { "phase1": 10, "phase2": 5, "phase3": 1 },
      "state": "UNMEASURED",
      "measuredValue": null,
      "sampleSize": null,
      "measurementProtocol": "Discrete user or agent actions required to reach an acceptable answer state",
      "evidenceArtifacts": [],
      "runLog": null,
      "phaseClaim": "none",
      "vacuousPass": false,
      "blockedBy": [
        "Undefined while no query path reaches an 'acceptable answer state' (0 results for all queries)",
        "No action instrumentation on any UI or agent surface"
      ]
    },
    {
      "metricId": "TAD.RELEVANCE.JFM",
      "figureRow": "Just-for-me",
      "type": "Outcome",
      "unit": "percent relevant",
      "phaseTargets": { "phase1": 70, "phase2": 83, "phase3": 98 },
      "state": "UNMEASURED",
      "measuredValue": null,
      "sampleSize": null,
      "measurementProtocol": "Blinded human evaluation, 0-3 rubric, score >= 2 counts relevant",
      "evidenceArtifacts": [],
      "runLog": null,
      "phaseClaim": "none",
      "vacuousPass": false,
      "blockedBy": [
        "No results to evaluate (0 results returned for all queries)",
        "No blinded evaluation harness or rubric instrument exists",
        "No per-actor personalization signal is wired into the query path"
      ]
    },
    {
      "metricId": "SYS.SPEEDUP",
      "figureRow": "Speed Improvement",
      "type": "Composite",
      "unit": "multiplier",
      "phaseTargets": { "phase1": "1.1x", "phase2": "2x", "phase3": "5x" },
      "state": "UNMEASURED",
      "measuredValue": null,
      "sampleSize": null,
      "measurementProtocol": "Time-on-task studies against a control condition",
      "evidenceArtifacts": [],
      "runLog": null,
      "phaseClaim": "none",
      "vacuousPass": false,
      "blockedBy": [
        "A speedup multiplier requires a baseline control condition, which has never been established",
        "Depends on TAD.LATENCY.JIT and TAD.ACTIONS.JE being non-vacuous first"
      ]
    },
    {
      "metricId": "SYS.SCALE.TBD",
      "figureRow": "Scale",
      "type": "Composite",
      "unit": "multi-dimensional",
      "phaseTargets": { "phase1": null, "phase2": null, "phase3": null },
      "state": "UNMEASURED",
      "measuredValue": null,
      "sampleSize": null,
      "measurementProtocol": "Policy/task/role graph statistics: |K| knowledge elements, |E| relations, |P(task)| policies per task, |CoP| communities of practice and role distributions, task throughput by role",
      "evidenceArtifacts": [],
      "runLog": null,
      "phaseClaim": "none",
      "vacuousPass": false,
      "blockedBy": [
        "Phase targets are themselves undefined (TBD/TBD/TBD in the contract)",
        "No org model exists to compute |K|, |E|, |P(task)|, |CoP| against"
      ],
      "notes": "This row is org-shaped, not product-shaped: its variables describe the organization's own knowledge/task/policy/role graph. It is the natural instrument for -- and is blocked on -- an organizational digital twin. See docs/design/org-digital-twin-v0.md."
    }
  ],
  "findings": [
    {
      "severity": "critical",
      "summary": "The entire retrieval tier is non-durable; no corpus can accumulate.",